{
  "schema_version": "scenery.toolchain.v1",
  "manifest_version": 1,
  "source_locks": [
    {
      "name": "go-modules",
      "kind": "go-modules",
      "manifest": "go.mod",
      "lock": "go.sum"
    },
    {
      "name": "dashboard-ui",
      "kind": "package-manager",
      "manager": "bun",
      "manifest": "ui/package.json",
      "lock": "ui/bun.lock"
    }
  ],
  "artifacts": [
    {
      "name": "grafana",
      "kind": "binary",
      "version": "13.0.2",
      "license": "AGPL-3.0-only",
      "default_binary": "grafana",
      "binaries": ["grafana", "grafana-server"],
      "platforms": {
        "linux/amd64": {
          "archive": "tar.gz",
          "url": "https://dl.grafana.com/oss/release/grafana-13.0.2.linux-amd64.tar.gz",
          "sha256": "6720d8b0b48d92e2b33b7bf30b38480c12964ccd87285e5e754aa554165edf2d",
          "extract": "bin/grafana",
          "home": true,
          "strip_components": 1
        },
        "darwin/arm64": {
          "archive": "tar.gz",
          "url": "https://dl.grafana.com/oss/release/grafana-13.0.2.darwin-arm64.tar.gz",
          "sha256": "fb4729934fd8e3a348312c4cec5ff2143f4c4c22670be63c272d3277c6d774ea",
          "extract": "bin/grafana",
          "home": true,
          "strip_components": 1
        }
      }
    },
    {
      "name": "caddy",
      "kind": "binary",
      "version": "2.11.4",
      "license": "Apache-2.0",
      "default_binary": "caddy",
      "binaries": ["caddy"],
      "platforms": {
        "linux/amd64": {
          "archive": "tar.gz",
          "url": "https://github.com/caddyserver/caddy/releases/download/v2.11.4/caddy_2.11.4_linux_amd64.tar.gz",
          "sha256": "527fbf917c39189a1e3b31d34fa955601680b2d5c8055d2a87b8b9588dec7bb9",
          "extract": "caddy"
        },
        "darwin/arm64": {
          "archive": "tar.gz",
          "url": "https://github.com/caddyserver/caddy/releases/download/v2.11.4/caddy_2.11.4_mac_arm64.tar.gz",
          "sha256": "9efb0af2d6cf09cfb5053c0e51721b9b3d4956d346234f39368d943d25a3c9a7",
          "extract": "caddy"
        }
      }
    },
    {
      "name": "dnsmasq",
      "kind": "binary",
      "version": "2.93",
      "license": "GPL-2.0-only OR GPL-3.0-only",
      "default_binary": "dnsmasq",
      "binaries": ["dnsmasq"],
      "platforms": {
        "linux/amd64": {
          "archive": "tar.gz",
          "url": "https://thekelleys.org.uk/dnsmasq/dnsmasq-2.93.tar.gz",
          "sha256": "cc967771abdafeb43d10db18932d6b59fd4bed2c69c22acf8cb96aff6920d55f",
          "extract": "dnsmasq",
          "strip_components": 1,
          "build": [
            "make install PREFIX={install}"
          ],
          "build_output": "sbin/dnsmasq"
        },
        "darwin/arm64": {
          "archive": "tar.gz",
          "url": "https://thekelleys.org.uk/dnsmasq/dnsmasq-2.93.tar.gz",
          "sha256": "cc967771abdafeb43d10db18932d6b59fd4bed2c69c22acf8cb96aff6920d55f",
          "extract": "dnsmasq",
          "strip_components": 1,
          "build": [
            "make install PREFIX={install} CFLAGS=\"-D__APPLE_USE_RFC_3542\""
          ],
          "build_output": "sbin/dnsmasq"
        }
      }
    },
    {
      "name": "victoriametrics-metrics-datasource",
      "kind": "plugin",
      "version": "0.25.0",
      "license": "Apache-2.0"
    },
    {
      "name": "victoriametrics-logs-datasource",
      "kind": "plugin",
      "version": "0.28.0",
      "license": "Apache-2.0"
    },
    {
      "name": "victoria-metrics",
      "kind": "binary",
      "version": "v1.145.0",
      "license": "Apache-2.0",
      "default_binary": "victoria-metrics-prod",
      "binaries": ["victoria-metrics-prod", "victoria-metrics"],
      "platforms": {
        "linux/amd64": {
          "archive": "tar.gz",
          "url": "https://github.com/VictoriaMetrics/VictoriaMetrics/releases/download/v1.145.0/victoria-metrics-linux-amd64-v1.145.0.tar.gz",
          "sha256": "1d6d47a4dd7f64ec534529fae6169b5d6b74a4bbe3f1e853b489d1f52404e409",
          "extract": "victoria-metrics-prod"
        },
        "darwin/arm64": {
          "archive": "tar.gz",
          "url": "https://github.com/VictoriaMetrics/VictoriaMetrics/releases/download/v1.145.0/victoria-metrics-darwin-arm64-v1.145.0.tar.gz",
          "sha256": "4d2f4aa3e53b9344e6c914217720ba8870d743e54826e02d97aa1fe935391fae",
          "extract": "victoria-metrics-prod"
        }
      },
      "images": [
        {
          "ref": "victoriametrics/victoria-metrics:v1.145.0",
          "optional": true,
          "usage": "dev.observability.metrics",
          "stability": "unstable"
        }
      ]
    },
    {
      "name": "victoria-logs",
      "kind": "binary",
      "version": "v1.50.0",
      "license": "Apache-2.0",
      "default_binary": "victoria-logs-prod",
      "binaries": ["victoria-logs-prod", "victoria-logs"],
      "platforms": {
        "linux/amd64": {
          "archive": "tar.gz",
          "url": "https://github.com/VictoriaMetrics/VictoriaLogs/releases/download/v1.50.0/victoria-logs-linux-amd64-v1.50.0.tar.gz",
          "sha256": "ab8a4503d88efe62ee72c51da2cf0215890e84ac4f6e1c6ab07d1318972f5ddc",
          "extract": "victoria-logs-prod"
        },
        "darwin/arm64": {
          "archive": "tar.gz",
          "url": "https://github.com/VictoriaMetrics/VictoriaLogs/releases/download/v1.50.0/victoria-logs-darwin-arm64-v1.50.0.tar.gz",
          "sha256": "536edba47c756e398870e418f0cf225604bd17d6a7a6abd899ad9a58f7639b8a",
          "extract": "victoria-logs-prod"
        }
      },
      "images": [
        {
          "ref": "victoriametrics/victoria-logs:v1.50.0",
          "optional": true,
          "usage": "dev.observability.logs",
          "stability": "unstable"
        }
      ]
    },
    {
      "name": "victoria-traces",
      "kind": "binary",
      "version": "v0.9.2",
      "license": "Apache-2.0",
      "default_binary": "victoria-traces-prod",
      "binaries": ["victoria-traces-prod", "victoria-traces"],
      "platforms": {
        "linux/amd64": {
          "archive": "tar.gz",
          "url": "https://github.com/VictoriaMetrics/VictoriaTraces/releases/download/v0.9.2/victoria-traces-linux-amd64-v0.9.2.tar.gz",
          "sha256": "1ba0379b075c725c563924991fe41a0cc34f353e4b3a6ed0c1af1ff7a977f07e",
          "extract": "victoria-traces-prod"
        },
        "darwin/arm64": {
          "archive": "tar.gz",
          "url": "https://github.com/VictoriaMetrics/VictoriaTraces/releases/download/v0.9.2/victoria-traces-darwin-arm64-v0.9.2.tar.gz",
          "sha256": "c6ca08319ec0183f733a580bec1451a024d867fd6e19770f73ea3f6e2ea90ebf",
          "extract": "victoria-traces-prod"
        }
      },
      "images": [
        {
          "ref": "victoriametrics/victoria-traces:v0.9.2",
          "optional": true,
          "usage": "dev.observability.traces",
          "stability": "unstable"
        }
      ]
    },
    {
      "name": "postgres",
      "kind": "image",
      "version": "18",
      "images": [
        {
          "ref": "postgres:18",
          "optional": true,
          "usage": "dev.services.postgres",
          "stability": "unstable"
        }
      ]
    },
    {
      "name": "temporal-cli",
      "kind": "binary",
      "version": "1.7.2",
      "license": "MIT",
      "default_binary": "temporal",
      "binaries": ["temporal"],
      "platforms": {
        "linux/amd64": {
          "archive": "tar.gz",
          "url": "https://github.com/temporalio/cli/releases/download/v1.7.2/temporal_cli_1.7.2_linux_amd64.tar.gz",
          "sha256": "e2f548af84e820b7d71f25fc6461a4e6a1ab7cdb6a80fde3c375641b0772375b",
          "extract": "temporal"
        },
        "darwin/arm64": {
          "archive": "tar.gz",
          "url": "https://github.com/temporalio/cli/releases/download/v1.7.2/temporal_cli_1.7.2_darwin_arm64.tar.gz",
          "sha256": "561ac68bdb6c16c8e8cbbd49f12578218ff1776007c3f3ae0d0196c8c9a73e79",
          "extract": "temporal"
        }
      }
    }
  ]
}
